{"$schema": "http://json-schema.org/schema#", "type": "object", "properties": {"kind": {"type": "string"}, "etag": {"type": "string"}, "pageInfo": {"type": "object", "properties": {"totalResults": {"type": "integer"}, "resultsPerPage": {"type": "integer"}}, "required": ["resultsPerPage", "totalResults"]}, "items": {"type": "array", "items": {"type": "object", "properties": {"kind": {"type": "string"}, "etag": {"type": "string"}, "id": {"type": "string"}, "snippet": {"type": "object", "properties": {"publishedAt": {"type": "string", "format": "date-time"}, "channelId": {"type": "string"}, "title": {"type": "string"}, "description": {"type": "string"}, "thumbnails": {"type": "object", "properties": {"medium": {"type": "object", "properties": {"url": {"type": "string"}, "width": {"type": "integer"}, "height": {"type": "integer"}}, "required": ["height", "url", "width"]}, "standard": {"type": "object", "properties": {"url": {"type": "string"}, "width": {"type": "integer"}, "height": {"type": "integer"}}, "required": ["height", "url", "width"]}, "maxres": {"type": "object", "properties": {"url": {"type": "string"}, "width": {"type": "integer"}, "height": {"type": "integer"}}, "required": ["height", "url", "width"]}, "default": {"type": "object", "properties": {"url": {"type": "string"}, "width": {"type": "integer"}, "height": {"type": "integer"}}, "required": ["height", "url", "width"]}, "high": {"type": "object", "properties": {"url": {"type": "string"}, "width": {"type": "integer"}, "height": {"type": "integer"}}, "required": ["height", "url", "width"]}, "fhd": {"type": "object", "properties": {"url": {"type": "string"}, "width": {"type": "integer"}, "height": {"type": "integer"}}, "required": ["height", "url", "width"]}, "uhd": {"type": "object", "properties": {"url": {"type": "string"}, "width": {"type": "integer"}, "height": {"type": "integer"}}, "required": ["height", "url", "width"]}, "qhd": {"type": "object", "properties": {"url": {"type": "string"}, "width": {"type": "integer"}, "height": {"type": "integer"}}, "required": ["height", "url", "width"]}}, "required": ["medium"]}, "channelTitle": {"type": "string"}, "localized": {"type": "object", "properties": {"title": {"type": "string"}, "description": {"type": "string"}}, "required": ["description", "title"]}, "defaultLanguage": {"type": "string"}}, "required": ["channelId", "channelTitle", "description", "localized", "publishedAt", "thumbnails", "title"]}, "status": {"type": "object", "properties": {"privacyStatus": {"type": "string"}}, "required": ["privacyStatus"]}, "contentDetails": {"type": "object", "properties": {"itemCount": {"type": "integer"}}, "required": ["itemCount"]}, "player": {"type": "object", "properties": {"embedHtml": {"type": "string"}}, "required": ["embedHtml"]}, "localizations": {"type": "object", "properties": {"en": {"type": "object", "properties": {"title": {"type": "string"}, "description": {"type": "string"}}, "required": ["title"]}, "ja": {"type": "object", "properties": {"title": {"type": "string"}, "description": {"type": "string"}}, "required": ["title"]}, "zh-TW": {"type": "object", "properties": {"title": {"type": "string"}}, "required": ["title"]}, "sw": {"type": "object", "properties": {"title": {"type": "string"}}, "required": ["title"]}, "am": {"type": "object", "properties": {"title": {"type": "string"}}, "required": ["title"]}, "zh-CN": {"type": "object", "properties": {"title": {"type": "string"}}, "required": ["title"]}, "fr": {"type": "object", "properties": {"title": {"type": "string"}}, "required": ["title"]}, "pl": {"type": "object", "properties": {"title": {"type": "string"}}, "required": ["title"]}, "kn": {"type": "object", "properties": {"title": {"type": "string"}}, "required": ["title"]}, "ko": {"type": "object", "properties": {"title": {"type": "string"}}, "required": ["title"]}, "gu": {"type": "object", "properties": {"title": {"type": "string"}}, "required": ["title"]}, "ru": {"type": "object", "properties": {"title": {"type": "string"}}, "required": ["title"]}, "ca": {"type": "object", "properties": {"title": {"type": "string"}}, "required": ["title"]}, "km": {"type": "object", "properties": {"title": {"type": "string"}}, "required": ["title"]}, "fa": {"type": "object", "properties": {"title": {"type": "string"}}, "required": ["title"]}, "az": {"type": "object", "properties": {"title": {"type": "string"}}, "required": ["title"]}, "de": {"type": "object", "properties": {"title": {"type": "string"}}, "required": ["title"]}, "hu": {"type": "object", "properties": {"title": {"type": "string"}}, "required": ["title"]}, "mr": {"type": "object", "properties": {"title": {"type": "string"}}, "required": ["title"]}, "uk": {"type": "object", "properties": {"title": {"type": "string"}}, "required": ["title"]}, "cs": {"type": "object", "properties": {"title": {"type": "string"}}, "required": ["title"]}, "si": {"type": "object", "properties": {"title": {"type": "string"}}, "required": ["title"]}, "it": {"type": "object", "properties": {"title": {"type": "string"}}, "required": ["title"]}, "ka": {"type": "object", "properties": {"title": {"type": "string"}}, "required": ["title"]}, "sl": {"type": "object", "properties": {"title": {"type": "string"}}, "required": ["title"]}, "fil": {"type": "object", "properties": {"title": {"type": "string"}}, "required": ["title"]}, "ar": {"type": "object", "properties": {"title": {"type": "string"}}, "required": ["title"]}, "es-419": {"type": "object", "properties": {"title": {"type": "string"}}, "required": ["title"]}, "my": {"type": "object", "properties": {"title": {"type": "string"}}, "required": ["title"]}, "sv": {"type": "object", "properties": {"title": {"type": "string"}}, "required": ["title"]}, "no": {"type": "object", "properties": {"title": {"type": "string"}}, "required": ["title"]}, "es-US": {"type": "object", "properties": {"title": {"type": "string"}}, "required": ["title"]}, "kk": {"type": "object", "properties": {"title": {"type": "string"}}, "required": ["title"]}, "hi": {"type": "object", "properties": {"title": {"type": "string"}}, "required": ["title"]}, "mk": {"type": "object", "properties": {"title": {"type": "string"}}, "required": ["title"]}, "ne": {"type": "object", "properties": {"title": {"type": "string"}}, "required": ["title"]}, "sq": {"type": "object", "properties": {"title": {"type": "string"}}, "required": ["title"]}, "bs": {"type": "object", "properties": {"title": {"type": "string"}}, "required": ["title"]}, "pt-PT": {"type": "object", "properties": {"title": {"type": "string"}}, "required": ["title"]}, "sk": {"type": "object", "properties": {"title": {"type": "string"}}, "required": ["title"]}, "lt": {"type": "object", "properties": {"title": {"type": "string"}}, "required": ["title"]}, "as": {"type": "object", "properties": {"title": {"type": "string"}}, "required": ["title"]}, "te": {"type": "object", "properties": {"title": {"type": "string"}}, "required": ["title"]}, "fr-CA": {"type": "object", "properties": {"title": {"type": "string"}}, "required": ["title"]}, "nl": {"type": "object", "properties": {"title": {"type": "string"}}, "required": ["title"]}, "or": {"type": "object", "properties": {"title": {"type": "string"}}, "required": ["title"]}, "mn": {"type": "object", "properties": {"title": {"type": "string"}}, "required": ["title"]}, "zh-HK": {"type": "object", "properties": {"title": {"type": "string"}}, "required": ["title"]}, "id": {"type": "object", "properties": {"title": {"type": "string"}}, "required": ["title"]}, "en-GB": {"type": "object", "properties": {"title": {"type": "string"}}, "required": ["title"]}, "sr": {"type": "object", "properties": {"title": {"type": "string"}}, "required": ["title"]}, "el": {"type": "object", "properties": {"title": {"type": "string"}}, "required": ["title"]}, "en-IN": {"type": "object", "properties": {"title": {"type": "string"}}, "required": ["title"]}, "es": {"type": "object", "properties": {"title": {"type": "string"}}, "required": ["title"]}, "ur": {"type": "object", "properties": {"title": {"type": "string"}}, "required": ["title"]}, "th": {"type": "object", "properties": {"title": {"type": "string"}}, "required": ["title"]}, "vi": {"type": "object", "properties": {"title": {"type": "string"}}, "required": ["title"]}, "bg": {"type": "object", "properties": {"title": {"type": "string"}}, "required": ["title"]}, "tr": {"type": "object", "properties": {"title": {"type": "string"}}, "required": ["title"]}, "lv": {"type": "object", "properties": {"title": {"type": "string"}}, "required": ["title"]}, "is": {"type": "object", "properties": {"title": {"type": "string"}}, "required": ["title"]}, "et": {"type": "object", "properties": {"title": {"type": "string"}}, "required": ["title"]}, "ta": {"type": "object", "properties": {"title": {"type": "string"}}, "required": ["title"]}, "ms": {"type": "object", "properties": {"title": {"type": "string"}}, "required": ["title"]}, "da": {"type": "object", "properties": {"title": {"type": "string"}}, "required": ["title"]}, "hr": {"type": "object", "properties": {"title": {"type": "string"}}, "required": ["title"]}, "pa": {"type": "object", "properties": {"title": {"type": "string"}}, "required": ["title"]}, "af": {"type": "object", "properties": {"title": {"type": "string"}}, "required": ["title"]}, "sr-Latn": {"type": "object", "properties": {"title": {"type": "string"}}, "required": ["title"]}, "zu": {"type": "object", "properties": {"title": {"type": "string"}}, "required": ["title"]}, "ky": {"type": "object", "properties": {"title": {"type": "string"}}, "required": ["title"]}, "hy": {"type": "object", "properties": {"title": {"type": "string"}}, "required": ["title"]}, "iw": {"type": "object", "properties": {"title": {"type": "string"}}, "required": ["title"]}, "pt": {"type": "object", "properties": {"title": {"type": "string"}}, "required": ["title"]}, "eu": {"type": "object", "properties": {"title": {"type": "string"}}, "required": ["title"]}, "bn": {"type": "object", "properties": {"title": {"type": "string"}}, "required": ["title"]}, "fi": {"type": "object", "properties": {"title": {"type": "string"}}, "required": ["title"]}, "ml": {"type": "object", "properties": {"title": {"type": "string"}}, "required": ["title"]}, "ro": {"type": "object", "properties": {"title": {"type": "string"}}, "required": ["title"]}, "gl": {"type": "object", "properties": {"title": {"type": "string"}}, "required": ["title"]}, "be": {"type": "object", "properties": {"title": {"type": "string"}}, "required": ["title"]}, "lo": {"type": "object", "properties": {"title": {"type": "string"}}, "required": ["title"]}, "uz": {"type": "object", "properties": {"title": {"type": "string"}}, "required": ["title"]}, "ar-XB": {"type": "object", "properties": {"title": {"type": "string"}}, "required": ["title"]}, "en-XA": {"type": "object", "properties": {"title": {"type": "string"}}, "required": ["title"]}}}}, "required": ["contentDetails", "etag", "id", "kind", "player", "snippet", "status"]}}, "nextPageToken": {"type": "string"}}, "required": ["etag", "items", "kind", "pageInfo"]}
