{
  "kind": "youtube#playlistListResponse",
  "etag": "rR0NQOiPN0HEhbdD6lYp454p0c4",
  "pageInfo": {
    "totalResults": 1,
    "resultsPerPage": 50
  },
  "items": [
    {
      "kind": "youtube#playlist",
      "etag": "LHyGacy_UOCS4V5p650Kkv5RELw",
      "id": "PLuhl9TnQPDCnWIhy_KSbtFwXVQnNvgfSh",
      "snippet": {
        "publishedAt": "2020-04-28T07:33:06.091651Z",
        "channelId": "UC4QobU6STFB0P71PMvOGN5A",
        "title": "YouTube",
        "description": "",
        "thumbnails": {
          "default": {
            "url": "https://i.ytimg.com/vi/lVI_J1cbFb4/default.jpg",
            "width": 120,
            "height": 90
          },
          "medium": {
            "url": "https://i.ytimg.com/vi/lVI_J1cbFb4/mqdefault.jpg",
            "width": 320,
            "height": 180
          },
          "high": {
            "url": "https://i.ytimg.com/vi/lVI_J1cbFb4/hqdefault.jpg",
            "width": 480,
            "height": 360
          },
          "standard": {
            "url": "https://i.ytimg.com/vi/lVI_J1cbFb4/sddefault.jpg",
            "width": 640,
            "height": 480
          },
          "maxres": {
            "url": "https://i.ytimg.com/vi/lVI_J1cbFb4/maxresdefault.jpg",
            "width": 1280,
            "height": 720
          }
        },
        "channelTitle": "jawed",
        "localized": {
          "title": "YouTube",
          "description": ""
        }
      },
      "status": {
        "privacyStatus": "public"
      },
      "contentDetails": {
        "itemCount": 4
      },
      "player": {
        "embedHtml": "\u003ciframe width=\"640\" height=\"360\" src=\"http://www.youtube.com/embed/videoseries?list=PLuhl9TnQPDCnWIhy_KSbtFwXVQnNvgfSh\" frameborder=\"0\" allow=\"accelerometer; autoplay; clipboard-write; encrypted-media; gyroscope; picture-in-picture; web-share\" referrerpolicy=\"strict-origin-when-cross-origin\" allowfullscreen\u003e\u003c/iframe\u003e"
      }
    }
  ]
}
