{
  "kind": "youtube#playlistListResponse",
  "etag": "xi3DTlG4S_c1uHv9Z1fFZRzoqg8",
  "pageInfo": {
    "totalResults": 1,
    "resultsPerPage": 50
  },
  "items": [
    {
      "kind": "youtube#playlist",
      "etag": "5Umkn82urCdNPdu_kaOSk12G_RU",
      "id": "OLAK5uy_lfFeKLvDqhTQwmfolUjDBfbyrjjgdmYcE",
      "snippet": {
        "publishedAt": "2025-07-10T14:48:06.348552Z",
        "channelId": "UCBR8-60-B28hp2BmDPdntcQ",
        "title": "Let God Sort Em Out",
        "description": "",
        "thumbnails": {
          "medium": {
            "url": "https://i9.ytimg.com/s_p/OLAK5uy_lfFeKLvDqhTQwmfolUjDBfbyrjjgdmYcE/mqdefault.jpg?sqp=CMSHl9QGir7X7AMICKmlv8MGEAE=&rs=AOn4CLBzB8wShNsCvM-w_D7VjAZW3iHN3w&v=1752158889",
            "width": 180,
            "height": 180
          },
          "standard": {
            "url": "https://i9.ytimg.com/s_p/OLAK5uy_lfFeKLvDqhTQwmfolUjDBfbyrjjgdmYcE/sddefault.jpg?sqp=CMSHl9QGir7X7AMICKmlv8MGEAE=&rs=AOn4CLBBjUYihbfgKnFAOxk9a03ydGAnMQ&v=1752158889",
            "width": 640,
            "height": 640
          },
          "maxres": {
            "url": "https://i9.ytimg.com/s_p/OLAK5uy_lfFeKLvDqhTQwmfolUjDBfbyrjjgdmYcE/maxresdefault.jpg?sqp=CMSHl9QGir7X7AMICKmlv8MGEAE=&rs=AOn4CLBA1sH1M1rlD7qsa8k6J0Ee8vV0bw&v=1752158889",
            "width": 1200,
            "height": 1200
          }
        },
        "channelTitle": "YouTube",
        "localized": {
          "title": "Let God Sort Em Out",
          "description": ""
        }
      },
      "status": {
        "privacyStatus": "public"
      },
      "contentDetails": {
        "itemCount": 13
      },
      "player": {
        "embedHtml": "<iframe width=\"640\" height=\"360\" src=\"http://www.youtube.com/embed/videoseries?list=OLAK5uy_lfFeKLvDqhTQwmfolUjDBfbyrjjgdmYcE\" frameborder=\"0\" allow=\"accelerometer; autoplay; clipboard-write; encrypted-media; gyroscope; picture-in-picture; web-share\" referrerpolicy=\"strict-origin-when-cross-origin\" allowfullscreen></iframe>"
      }
    }
  ]
}
